カテゴリー,問題番号,問題,選択肢,正解,解説
関税法（輸出通関）,57-19-3,関税法第70条第1項の規定に基づき、外国為替及び外国貿易法第48条第1項及び輸出貿易管理令第1条第1項の規定により輸出に関して経済産業大臣の許可を必要とする貨物を輸出しようとする者は、当該貨物について輸出の許可を受けるまでに当該経済産業大臣の許可を受けている旨を税関に証明しなければならない。,○×,×,輸出に際して他法令の規定による許可の証明を要するときは、輸出の許可を受けるまでではなく、輸出申告の際に、許可を受けている旨を税関に証明しなければならない(関税法70条1項)。
関税法（輸出通関）,57-19-4,本邦の船舶により公海で採捕された水産物を洋上から直接外国に向けて送り出す場合には、関税法の規定に基づく輸出の手続を要しない。,○×,×,本邦の船舶により公海で採捕された水産物は、内国貨物となる(関税法2条1項4号、2項)。内国貨物を外国に向けて送り出すことは輸出であるから(同条1項2号)、関税法の規定に基づく輸出の手続を要する(同法67条)。
関税法（輸出通関）,57-19-5,本邦に本店又は主たる事務所を有しない法人が本邦にその事務所及び事業所を有しない場合において、当該法人が貨物を本邦から輸出しようとするときは、当該法人は、税関事務管理人を定め、その定めた旨を税関長に届け出なければならない。,○×,○,本邦に本店か主たる事務所を有しない法人が、本邦に事務所も事業所を有しない場合において、税関関係手続及びこれに関する事項を処理する必要があるときは、当該法人は、税関事務管理人を定め、その定めた旨を税関長に届け出なければならない(関税法95条1項2項)。「税関関係手続」とは、輸入申告その他関税法又は関税定率法その他の関税に関する法律の規定に基づく手続（本邦に入国する者又は本邦から出国する者がその入国又は出国の際に行うものその他政令で定めるものを除く。）をいうが(同条9項)、貨物を本邦から輸出しようとすることは輸出申告のように関税法の規定に基づく手続を要するので、税関関係手続に当たる。
関税法（原産地表示）,57-20-1,税関長は、原産地について偽った表示がされている外国貨物については、その表示がある旨を輸入申告をした者に直ちに通知し、期間を指定して、その者の選択により、その表示を消させ、若しくは訂正させ、又は当該貨物を滅却させなければならない。,○×,×,その表示を消させ、若しくは訂正させ、又は当該貨物を滅却させなければならないのではなく、その表示を消させ、若しくは訂正させ、又は当該貨物を「積みもどさせ」なければならないのである(関税法71条2項)。滅却させることはできず、積戻しを命じることができる。
関税法（輸入通関）,57-20-2,特例輸入者又は特例委託輸入者が電子情報処理組織(NACCS)を使用して行う輸入申告は、当該輸入申告に係る貨物を保税地域等に入れる前に行うことができる。,○×,○,輸出申告は貨物を保税地域等に入れる前に行うことができるが、輸入申告は原則として保税地域等に入れた後に行う必要があり、輸入申告の特例（特例輸入者又は特例委託輸入者が電子情報処理組織(NACCS)を使用して行う輸入申告）の場合は例外的に保税地域等に入れる前に行うことができる(関税法67条の2第3項3号、同法施行令59条の6第3項)。
関税法（輸入通関）,57-20-3,賦課課税方式が適用される郵便物に係る関税を納付しようとする者は、その納付を日本郵便株式会社に委託することはできない。,○×,×,賦課課税方式が適用される郵便物は簡易手続の対象となる郵便物であるから、関税の納付も日本郵便株式会社に委託する(関税法77条3項)。
関税法（輸入通関）,57-20-4,はしけに積み込んだ状態で輸入申告をすることが必要な貨物を輸入しようとする者は、税関長に届け出ることにより、当該はしけの係留場所を所轄する税関長に対して輸入申告をすることができる。,○×,×,ふ中扱いをするためには、税関長の承認を要する(関税法67条の2第2項)。届出は、私はこうしますよということを民間人が役所にお知らせすることであり、届出の形式が守られていればそれに対して役所が拒否することはできない。対して承認や許可は、役所が内容を審査して拒否することも可能で、拒否しない場合は承認や許可がなされる。イメージとしては、役所による審査が厳しい順に並べると、許可、承認、届出となる。ただし実際の運用上は届出、承認、許可という違いだけによって審査の厳しさが決まるわけではないし、むしろこれらの内容の区別はあいまいである。試験では内容について細かいことは問われないので、届出、承認、許可のうちいずれの名称なのかだけ覚えておくのがよい。
関税法（輸入通関）,57-20-5,輸入しようとする外国貨物を保税蔵置場に置くことの承認の申請の際に、当該外国貨物につき経済連携協定における関税についての特別の規定による便益の適用を受けるために締約国原産地証明書を税関長に提出した場合であっても、当該外国貨物の輸入申告の際には、当該締約国原産地証明書の写しを当該税関長に提出しなければならない。,○×,×,輸入しようとする外国貨物を保税蔵置場に置くことの承認（蔵入承認）の申請をする際、経済連携協定における関税についての特別の規定による便益（EPA税率）の適用を受ける場合は併せて原産地を証明する書類や運送要件証明書の提出を要するが、その後の輸入申告時には提出不要である(関税法施行令36条の3)。
関税法（輸入通関）,57-21-1,一の輸入申告に係る貨物について輸入の許可前における貨物の引取りの承認を受けた場合には、その貨物を分割して引き取ることはできない。,○×,×,輸入許可前引取承認を受けた貨物については、分割してその一部だけを引き取ることもできる(関税法73条1項、同法施行令63条)。
関税法（輸入通関）,57-21-2,輸入の許可前における貨物の引取りの承認を受けた場合には、その輸入の許可を受けるまでは、その承認を受けた貨物の納税申告に係る課税標準又は納付すべき税額について修正申告をすることはできない。,○×,×,修正申告は税関長による更正があるまですることができるが(関税法7条の14第1項)、輸入許可前引取承認を受けた貨物について例外的な扱いがされているわけではないため、輸入許可前引取承認を受けた貨物についての納税申告の場合も同様となる。
関税法（輸入通関）,57-21-3,輸入の許可前における貨物の引取りの承認を受けようとする場合において、当該承認の前に当該貨物の納税申告に係る納付すべき税額に更正があり、当該更正に基づき過少申告加算税が課されているときは、当該過少申告加算税に相当する額を除いた関税額に相当する担保を提供しなければならない。,○×,○,輸入許可前引取承認を申請する者は、関税額（過少申告加算税と過少申告加算税に代わる重加算税に相当する額を除く。）に相当する担保を提供して税関長の承認を受けなければならない(関税法73条1項)。
関税法（輸入通関）,57-21-4,輸入の許可前における貨物の引取りの承認は、その貨物の関税が有税とされている場合に限り受けることができる。,○×,×,税関長は、貨物が有税品か無税品かにかかわらず承認できる(関税法基本通達73-3-2)。
関税法（輸入通関）,57-21-5,特例輸入者又は特例委託輸入者が輸入の許可前における貨物の引取りの承認を受けようとする場合には、関税額に相当する担保を提供することを要しない。,○×,×,"特例輸入者や特例委託輸入者が輸入許可前引取承認を受けようとする場合も担保提供を要する(関税法73条1項)。
なお、特例申告貨物を輸入する場合は輸入許可前引取承認を利用できないが(同項)、特例輸入者や特例委託輸入者は特例輸入申告しかできないのではなく普通の輸入申告も選択できるため、普通の輸入申告を選択するときは輸入許可前引取承認を利用できる。その場合でも、輸入許可前引取承認を受けようとするなら担保提供が必要であるということを本問は述べている。
これは試験によくある引っ掛けで、特例輸入者や特例委託輸入者が輸入申告するから必ず特例輸入申告であるとは考えないでほしい。特例輸入者や特例委託輸入者が輸入許可前引取承認を受けようとする旨が問題文に書かれており、かつ、特例輸入申告を利用するとは書かれていないときは、普通の輸入申告を選択した場合を指している。"
関税法（保税地域）,57-22-1,保税工場の許可を受けた者は、当該保税工場において使用する輸入貨物については、当該貨物を当該保税工場に入れた日から2年までの期間に限り、当該保税工場につき保税蔵置場の許可を併せて受けているものとみなされる。,○×,×,2年ではなく3月である。保税工場の許可を受けた者は、当該保税工場において使用する輸入貨物については、貨物を入れた日から3月までの期間に限り、当該保税工場につき保税蔵置場の許可を併せて受けているものとみなす（みなし保税蔵置場 関税法56条2項）。つまり、貨物を保税工場に入れてから3月以内の期間は、保税蔵置場としての許可を受けていなくても保税工場は保税蔵置場とみなされるので、保税蔵置場同様に一時蔵置ができる。
関税法（保税地域）,57-22-2,税関長は、保税展示場に入れられた外国貨物が、当該保税展示場の許可の期間の満了の際、当該保税展示場にある場合には、当該保税展示場の許可を受けた者から、直ちにその関税を徴収することとされている。,○×,×,税関長は、保税展示場に入れられた外国貨物で、保税展示場の許可の期間の満了又は許可の失効の際、その保税展示場にあるものについては、許可を受けた者に対し、期間を定めて貨物の搬出その他の処置を求めることができる。定められた期間内に当該処置がされないときは、許可を受けた者から、直ちにその関税を徴収する(関税法62条の6第1項)。つまり時系列では、①保税展示場の許可の期間の満了又は許可の失効→② 期間を定めて貨物の搬出その他の処置を求める→③定められた期間内に当該処置がされないときは直ちにその関税を徴収となるが、本問は②を飛ばして関税を直ちに徴収すると述べているので誤りとなる。
関税法（保税地域）,57-22-3,関税法第30条第1項第2号(外国貨物を置く場所の制限)の規定により保税地域以外の場所に置くことを税関長が許可した外国貨物につき内容の点検をしようとするときは、あらかじめその旨を税関に届け出なければならない。,○×,○,"「関税法第30条第1項第2号(外国貨物を置く場所の制限)の規定により保税地域以外の場所に置くことを税関長が許可した外国貨物」とは、他所蔵置許可場所に置くことを許可された外国貨物を指すが、他所蔵置許可場所というのは法律上の正式名称ではない。関税法では保税地域以外の場所に貨物を置ける例外の1つとして「保税地域に置くことが困難又は著しく不適当であると認め税関長が期間及び場所を指定して許可した貨物」という規定が存在するだけであり、その場所を一般的に他所蔵置許可場所と呼んでいるだけなので、試験問題として出題されるときはこのような表現となっている。
他所蔵置許可場所で貨物の内容の点検、改装、仕分け、その他の手入れを行うときは、あらかじめ税関に届け出なければならない(同法36条2項)。"
関税法（保税地域）,57-22-4,保税工場において、外国貨物についての加工若しくはこれを原料とする製造(混合を含む。)又は外国貨物に係る改装、仕分その他の手入れをしようとする者は、その開始の時までに税関長の承認を受けなければならない。,○×,×,保税工場において、保税作業（＝外国貨物についての加工、外国貨物を原料とする製造（混合を含む。）、外国貨物に係る改装、仕分、その他の手入）をしようとする者は、その開始の際と終了の際、その旨を税関に届け出る必要がある(関税法56条1項、58条)。したがって「その開始の時までに税関長の承認を受けなければならない」とする部分が誤りであり、「その開始の時までに税関に届け出なければならない」であれば正しい記述となる。
関税法（保税地域）,57-22-5,保税蔵置場において貨物を管理する者は、当該保税蔵置場から外国貨物を出した場合であっても、関税法第32条(見本の一時持出)の規定による許可を受けて当該保税蔵置場から当該外国貨物を見本として一時持ち出したときは、同法第34条の2(記帳義務)に規定する帳簿に当該外国貨物の記号、番号、品名及び数量を記載することを要しない。,○×,×,"保税蔵置場において貨物を管理する者は、関税法32条(見本の一時持出)の規定による許可を受けて当該保税蔵置場から当該外国貨物を見本として一時持ち出したときは、同法34条の2(記帳義務)に規定する帳簿に当該貨物の記号、番号、品名及び数量、当該許可に係る期間、持ち出し先、当該一時持ち出しの年月日を記載することを要する(同法施行令29条の2第1項6号)。
保税地域の帳簿については記載事項がかなり細かく決まっているが、試験対策としては、①貨物の出し入れ（搬出入）や各保税地域で行うことが法律上認められている行為については殆ど記載事項であり、②廃棄については記載事項ではない、ということさえ知っていれば大体対応できる。廃棄は保税地域から搬出して行うので、搬出について記帳していればその後の廃棄は保税地域外での出来事だから記帳しなくてよいのである。"
関税定率法（軽減・免除・払戻し）,57-23-1,本邦から輸出された貨物でその輸出の許可の日から1年を経過した後に輸入されるものについては、その輸出の許可の際の性質及び形状が変わっていないものであっても、関税定率法第14条第10号(無条件免税)の規定により関税の免除を受けることができない。,○×,×,本邦から輸出された貨物でその輸出の許可の際の性質及び形状が変わっていないものは関税定率法14条10号(無条件免税)の規定により関税の免除を受けることができ、輸出の許可の日から1年を経過した後に輸入されるものは免除を受けられないという規定はない。
関税定率法（軽減・免除・払戻し）,57-23-2,加工のため本邦から輸出され、その輸出の許可の日から1年以内に輸入される貨物については、本邦においてその加工をすることが困難であると認められるものに限り、関税定率法第11条(加工又は修繕のため輸出された貨物の減税)の規定により関税の軽減を受けることができる。),○×,○,加工又は修繕のため本邦から輸出され、その輸出の許可の日から1年（1年を超えることがやむを得ないと認められる理由がある場合において、税関長の承認を受けたときは、1年を超え税関長が指定する期間）以内に輸入される貨物（加工のためのものについては、本邦においてその加工をすることが困難であると認められるものに限る。）については、関税を軽減することができる(関税定率法11条)。
関税定率法（軽減・免除・払戻し）,57-23-3,関税暫定措置法第9条第1項(軽減税率等の適用手続)に規定する軽減税率の適用を受けて貨物を輸入しようとする者は、その軽減される関税の額に相当する担保を税関長に提供しなければならない。,○×,×,軽減税率の適用を受けて貨物を輸入する際に、担保提供を要する旨の規定はない(暫定措置法9条参照)。
関税定率法（軽減・免除・払戻し）,57-23-4,関税を納付して輸入された貨物のうち品質が契約の内容と相違するため返送することがやむを得ないと認められる貨物であって、その輸入の時の性質及び形状に変更を加えないものを本邦から返送のため輸出するときは、当該貨物がその輸入の許可の日から3月以内に保税地域に入れられたものである場合に限り、関税定率法第20条第1項(違約品等の再輸出又は廃棄の場合の戻し税等)の規定により関税の払戻しを受けることができる。,○×,×,輸入の許可の日から3月以内ではなく、輸入の許可の日から6月以内である(関税定率法20条1項)。
関税定率法（軽減・免除・払戻し）,57-23-5,修繕のため本邦から輸出され、その輸出の許可の日から1年以内に輸入される貨物については、本邦においてその修繕をすることが困難であると認められるものに限り、関税定率法第11条(加工又は修繕のため輸出された貨物の減税)の規定により関税の軽減を受けることができる。,○×,×,加工又は修繕のため本邦から輸出され、その輸出の許可の日から1年（1年を超えることがやむを得ないと認められる理由がある場合において、税関長の承認を受けたときは、1年を超え税関長が指定する期間）以内に輸入される貨物（加工のためのものについては、本邦においてその加工をすることが困難であると認められるものに限る。）については、関税を軽減することができる(関税定率法11条)。修繕のためのものについては、本邦において修繕をすることが困難であると認められるものに限るという要件はない。
関税定率法（課税価格の決定）,57-24-1,課税価格を計算する場合において、輸入貨物に係る取引の状況その他の事情からみて輸入申告の時(関税法第4条第1項第2号から第8号まで(課税物件の確定の時期)に掲げる貨物にあっては、当該各号に定める時)までに当該輸入貨物に変質があったと認められるときは、当該輸入貨物の課税価格は、当該変質がなかったものとした場合に計算される課税価格からその変質があったことによる減価に相当する額を控除して得られる価格とする。,○×,○,課税価格の決定の例外ルールである、変質又は損傷に係る輸入貨物の課税価格の決定(関税定率法4条の5)について述べている。
関税定率法（課税価格の決定）,57-24-2,輸入貨物に係る輸入取引が延払条件付取引である場合において、その延払金利の額が明らかであるときは、当該延払金利の額は関税定率法第4条第1項に規定する当該輸入貨物につき現実に支払われた又は支払われるべき価格に含まないものとする。,○×,○,延払金利は金額が明らかでないときを除いて控除費用であるから、延払金利の額が明らかであるときは輸入貨物の現実支払価格に含まない(関税法施行令1条の4第4号)。
関税定率法（課税価格の決定）,57-24-3,輸入貨物に係る輸入取引に関し、買手による当該輸入貨物の処分又は使用についての制限で法令により課されるものがあることは、関税定率法第4条第1項の規定により当該輸入貨物の課税価格を決定することができないこととなる事情には該当しない。,○×,○,"課税価格の決定は、原則的には関税定率法4条1項で定められたルールにより行うが、輸⼊取引に関する特別な事情があれば例外的に同法4条の2以下で定められたルールにより行う。
基本的には買⼿による輸⼊貨物の処分・使⽤につき制限があるときは特別な事情となるが、買⼿による輸⼊貨物の処分・使⽤についての制限で、法令あるいは国・地⽅公共団体によって課されるか要求されるものであれば特別な事情とはならない（関税定率法4条2項1号、同法施⾏令1条の7第2号、同法基本通達4-15）。したがって、輸入貨物に係る輸入取引に関し、買手による当該輸入貨物の処分又は使用についての制限で法令により課されるものがあることは、同法4条1項の規定により当該輸入貨物の課税価格を決定することができないこととなる事情（特別な事情）には該当しない。"
関税定率法（課税価格の決定）,57-24-4,買手が自己のために行う輸入貨物についての広告宣伝に係る費用で買手が負担するものは、当該広告宣伝が売手の利益になると認められる活動に係るものである場合に限り、当該費用は関税定率法第4条第1項に規定する当該輸入貨物につき現実に支払われた又は支払われるべき価格に加算するものとされている。,○×,×,買手が自己のために行う輸入貨物についての広告宣伝に係る費用で買手が負担するものは、当該広告宣伝が売手の利益になると認められる活動に係るものであっても、現実支払価格に加算しない(関税定率法基本通達4-2(4))。買⼿の自己活動費⽤は、たとえ売⼿の利益になっても控除費用である。
関税定率法（課税価格の決定）,57-24-5,航空機による運送方法以外の運送方法による輸入貨物の運送が特殊な事情の下において行われたことにより、当該輸入貨物の実際に要した当該輸入港までの運賃の額が当該輸入貨物の通常必要とされる当該輸入港までの運賃の額を著しく超えるものである場合には、当該輸入貨物の当該輸入港までの運賃は、当該通常必要とされる当該輸入港までの運賃とする。,○×,○,輸⼊港に到着するまでの運送に要する運賃、保険料その他当該運送に関連する費⽤は加算費⽤である。原則は実費を加算費用とするが、輸⼊貨物の運送に特殊な事情が発⽣したため通常必要とされる運賃等の額を著しく超える場合には、通常必要とされる輸⼊港までの運賃等を加算費用とする(関税定率法4条1項1号、同法施行令1条の5第1項)。
