カテゴリー,問題番号,問題,選択肢,正解,解説
外国為替及び外国貿易法,57-14-4,輸出貿易管理令別表第1の16の項の中欄に掲げる関税定率法別表第95類に該当する玩具を、ドイツを仕向地として輸出しようとする場合には、経済産業大臣の輸出の許可を受けなければならない。,○×,×,"輸出令別表第1中欄に掲げる貨物を同表下欄に掲げる地域を仕向地として輸出とする場合、経済産業大臣の輸出の許可を要するのが原則である(外為法48条1項、輸出令1条)。輸出令別表第1は1から16までの項が存在するが、1の項から15の項までの中欄に掲げる貨物については、どの地域に向けて輸出する場合でも経済産業大臣の輸出の許可を要する。16の項の中欄に掲げる貨物については、別表第3に掲げる地域以外の地域に向けて輸出する場合に経済産業大臣の輸出の許可を要する。別表第3に掲げる地域とは、アルゼンチン、オーストラリア、オーストリア、ベルギー、ブルガリア、カナダ、チェコ、デンマーク、フィンランド、フランス、ドイツ、ギリシャ、ハンガリー、アイルランド、イタリア、大韓民国、ルクセンブルク、オランダ、ニュージーランド、ノルウェー、ポーランド、ポルトガル、スペイン、スウェーデン、スイス、英国、アメリカ合衆国である。
そうすると、輸出貿易管理令別表第1の16の項の中欄に掲げる貨物を、ドイツを仕向地として輸出しようとする場合には、経済産業大臣の輸出の許可を受けなくてもよいことになる。"
外国為替及び外国貿易法,57-14-5,経済産業大臣は、外国為替及び外国貿易法第48条第1項の規定により経済産業大臣の輸出の許可を受けなければならない貨物について、当該輸出の許可を受けないで貨物を輸出した者に対し、3年以内の期間を限り、輸出を行うことを禁止することができる。,○×,○,外為法53条1項にその通りの規定がある。
関税法（輸入してはならない貨物）,57-15-1,印紙の模造品は、印紙等模造取締法の規定により財務大臣の許可を受けて輸入するものを除き、輸入してはならない貨物に該当する。,○×,○,印紙の模造品は印紙等模造取締法1条2項の規定により財務大臣の許可を受けて輸入するもの、郵便切手の模造品は郵便切手類模造等取締法1条2項の規定により総務大臣の許可を受けて輸入するものを除いて、輸入してはならない貨物である(関税法69条の11第1項6号)。
関税法（輸入してはならない貨物）,57-15-2,税関長は、公安又は風俗を害すべき書籍に該当する貨物で輸入されようとするものについて、没収して廃棄することができる。,○×,×,税関長は、輸入してはならない貨物のうち表現物（公安又は風俗を害すべき書籍、図画、彫刻物その他の物品、児童ポルノ）について、これらに該当すると認めるのに相当の理由がある旨を通知しなければならないが、没収廃棄や積戻し命令をすることはできない(関税法69条の11第1項7号8号、2項3項)。
関税法（輸入してはならない貨物）,57-15-3,税関長は、輸入されようとする貨物のうちに児童ポルノに該当すると認めるのに相当の理由がある貨物があるときであっても、当該貨物を輸入しようとする者に対し、その旨を通知することを要しない。,○×,×,税関長は、輸入してはならない貨物のうち表現物（公安又は風俗を害すべき書籍、図画、彫刻物その他の物品、児童ポルノ）について、これらに該当すると認めるのに相当の理由があるときは、その旨を通知しなければならない(関税法69条の11第1項7号8号、3項)。
関税法（輸入してはならない貨物）,57-15-4,税関長は、輸入されようとする貨物が特許権を侵害する貨物に該当するか否かについての認定手続を執る場合には、当該貨物に係る特許権者及び当該貨物を輸入しようとする者に対し、当該貨物が当該特許権を侵害する貨物に該当するか否かについて意見を述べることができる旨を通知することを要しない。,○×,×,税関長は、輸入されようとする貨物が特許権を侵害する貨物に該当するか否かについての認定手続を執る場合には、当該貨物に係る特許権者及び当該貨物を輸入しようとする者に対し、認定手続を執る旨と、当該貨物が当該特許権を侵害する貨物に該当するか否かについて証拠を提出し意見を述べることができる旨を通知しなければならない(関税法69条の12第1項)。したがって、「意見を述べることができる旨を通知することを要しない」とする部分が誤りであり、意見を述べることができる旨を通知しなければならないのである。
関税法（輸入してはならない貨物）,57-15-5,著作権者は、自己の著作権を侵害すると認める貨物に関し、いずれかの税関長に対し、その侵害の事実を疎明するために必要な証拠を提出し、当該貨物が関税法第6章(通関)に定めるところに従い輸入されようとする場合は、当該貨物について当該税関長又は他の税関長が、当該貨物が当該著作権を侵害する貨物に該当するか否かについての認定手続を執るべきことを申し立てることができる。,○×,○,著作権者は輸入差止申立てができるので、本問はその旨を述べており正しい(関税法69条の13第1項)。
関税法（関税の確定・納付）,57-16-1,関税の課税物件の確定の時期について、保税展示場に入れられた外国貨物のうち、当該保税展示場における販売又は消費を目的とするもの(関税法第4条第1項第3号の2に掲げるもの)に対し関税を課する場合の基礎となる当該貨物の性質及び数量は、当該貨物を当該保税展示場において展示又は使用の行為をすることが税関長により承認された時における現況による。,○×,○,保税展示場に入れられた外国貨物は、①積卸し、運搬、蔵置、②内容の点検、改装、仕分け、その他の手入れ、③展示、使用ができるが、外国貨物を保税展示場に入れる者は、税関長に申告して①から③の行為をすることについての承認を受ける必要がある（展示等の承認）。そして、保税展示場における販売又は消費を目的とする外国貨物についての課税物件確定時期は、展示等の承認がされた時である(関税法4条1項3号の2、62条の3第1項)。
関税法（関税の確定・納付）,57-16-2,関税の課税物件の確定の時期について、税関長が、保税地域に置くことが困難であると認め期間及び場所を指定して、保税地域以外の場所に置くことを許可した外国貨物で、その場所において亡失したもの(関税法第4条第1項第4号に掲げるもの)に対し関税を課する場合の基礎となる当該貨物の性質及び数量は、その亡失の時における現況による。,○×,○,"保税地域等にある外国貨物で、亡失し、又は滅却されたものについての課税物件確定時期は、亡失又は滅却の時である(関税法4条1項4号)。保税地域等の「等」は他所蔵置許可場所を指すが、他所蔵置許可場所というのは法律上の正式名称ではない。関税法では保税地域以外の場所に貨物を置ける例外の1つとして「保税地域に置くことが困難又は著しく不適当であると認め税関長が期間及び場所を指定して許可した貨物」という規定が存在するだけであり(30条1項2号)、その場所を一般的に他所蔵置許可場所と呼んでいるだけなので、試験問題として出題されるときはこの規定に沿った表現が使用される。
つまり本問の「税関長が、保税地域に置くことが困難であると認め期間及び場所を指定して、保税地域以外の場所に置くことを許可した外国貨物」とは、他所蔵置許可場所に置くことの許可を受けて置かれた外国貨物のことを指すため、保税地域「等」にある外国貨物で、亡失し、又は滅却されたものについての課税物件確定時期について述べていることとなる。

なお、保税蔵置場又は総合保税地域に置かれた外国貨物の課税物件確定時期が蔵入承認時又は総保入承認時となる(4条1項1号)こととの関係について、よく引っ掛けとして出題される。課税物件確定時期の判断において、保税蔵置場又は総合保税地域に「置かれた」というのは、蔵入承認又は総保入承認を受けていることを意味する。この「置かれた」という表現が使われていない場合、つまり例えば保税蔵置場に「ある」、保税蔵置場に「入れた」というような場合は、承認を受けていないということである。
そして、1号は4号の規定（保税地域等にある外国貨物で、亡失し、又は滅却されたものについての課税物件確定時期は、亡失又は滅却の時であるとする規定）に優先する旨が4号に書かれている。
したがって、保税地域に「置かれた」外国貨物で、亡失し、又は滅却されたものについての課税物件確定時期は、亡失又は滅却の時ではなく蔵入承認時又は総保入承認時となる。
保税地域内での亡失・滅却の課税物件確定時期は、蔵入承認又は総保入承認を受けた外国貨物（「置かれた」外国貨物）なら承認時、受けてないなら亡失・滅却時と覚えよう。"
関税法（関税の確定・納付）,57-16-3,関税の課税物件の確定の時期について、本邦と外国との間を往来する船舶への積込みの承認を受けて保税地域から引き取られた外国貨物である船用品(一括して積込みの承認を受けたものを除く。)で、その指定された積込みの期間内に船舶に積み込まれないもの(関税法第4条第1項第5号に掲げるもの)に対し関税を課する場合の基礎となる当該貨物の性質及び数量は、当該承認に係る外国貨物が保税地域から引き取られた時の現況による。,○×,×,本邦と外国との間を往来する船舶・航空機への積込みの承認を受けて保税地域から引き取られた外国貨物である船用品・機用品で、その指定された積込みの期間内に船舶に積み込まれないものについての課税物件確定時期は、一括して積込みの承認を受けていない場合は積込み承認時であり、一括して積込みの承認を受けた場合は貨物が保税地域から引き取られた時である(関税法4条1項5号)。本問は「(一括して積込みの承認を受けたものを除く。)」とされているため、一括して積込みの承認を受けていない場合を指しているから、積込み承認時となる。
関税法（関税の確定・納付）,57-16-4,関税の課税物件の確定の時期について、税関長が、1年の範囲内で運送の期間を指定して、一括して保税運送を承認した外国貨物で、その指定された運送の期間内に運送先に到着しないもの(関税法第4条第1項第5号に掲げるもの)に対し関税を課する場合の基礎となる当該貨物の性質及び数量は、当該承認に係る外国貨物が発送された時における現況による。,○×,○,保税運送の承認を受けて運送された外国貨物で、その指定された運送の期間内に運送先に到着しないものについての課税物件確定時期は、一括して保税運送の承認を受けていない場合は運送の承認時であり、一括して保税運送の承認を受けた場合は貨物が発送された時である(関税法4条1項5号)。
関税法（関税の確定・納付）,57-16-5,関税の課税物件の確定の時期について、留置された貨物で、公売に付されるものに対し関税を課する場合の基礎となる当該貨物の性質及び数量は、その公売の時における現況による。,○×,○,収容された貨物、留置された貨物、差押物件、領置物件のいずれかで、公売に付されるか随意契約により売却されるものについての課税物件確定時期は、公売に付されるものについては公売の時であり、随意契約により売却されるものについては売却の時である(関税法4条1項7号)。
関税法（関税の確定・納付）,57-17-1,関税定率法第15条第1項(特定用途免税)の規定により関税の免除を受けて輸入された貨物について、特定用途免税に係る特定の用途以外の用途に供するため譲渡されたことにより、その免除を受けた関税を徴収する場合には、その譲渡をした者がその関税を納める義務を負う。,○×,○,特定用途免税の規定により関税の免除を受けた貨物が輸入の許可の日から2年以内に用途以外の用途に供された場合は、免除を受けた関税が直ちに徴収される。この免除を受けた関税を徴収される者（つまり免除を受けた関税を納める義務を負う者）は、用途以外の用途に供された場合は供した者であり、用途以外の用途に供するため譲渡された場合においては譲渡をした者となる(関税定率法15条1項)。
関税法（関税の確定・納付）,57-17-2,本邦と外国との間を往来する船舶の旅客がその携帯品である外国貨物を輸入する前に本邦においてその個人的な用途に供するため消費した場合には、当該外国貨物を輸入したものとみなし、当該旅客がその関税を納める義務を負う。,○×,×,"外国貨物が輸入される前に本邦において使用・消費される場合には、使用・消費する者がその使用・消費の時に当該貨物を輸入するものとみなすのが原則である(みなし輸入 関税法2条3項)。このとき、使用・消費する者が輸入するとみなすのであるから、使用・消費する者が輸入者であり関税を納める義務を負う。
しかし例外として、旅客又は乗組員がその携帯品である外国貨物をその個人的な用途に供するため使用・消費する場合はみなし輸入とされない(同法施行令1条の2第2項)。
本問は例外に当たるため、みなし輸入とされず関税の納付義務がない。"
関税法（関税の確定・納付）,57-17-3,指定保税地域にある外国貨物(輸出の許可を受けた貨物を除く。)が亡失したときは、当該外国貨物が災害その他やむを得ない事情により亡失した場合を除き、当該外国貨物を管理する者がその関税を納める義務を負う。,○×,○,保税地域等にある外国貨物で輸出の許可を受けた貨物以外の貨物が亡失したときは、災害その他やむを得ない事情により亡失した場合を除き、保税地域等の許可を受けた者（指定保税地域の場合は外国貨物の管理者）がその関税を納める義務を負う(関税法36条1項、41条の3、45条1項、61条の4、62条の7、62条の13)。
関税法（関税の確定・納付）,57-17-4,保税運送の承認を受けて運送された外国貨物(輸出の許可を受けた貨物を除く。)が亡失したことにより、その承認の際に指定された運送の期間内に運送先に到着しないときは、当該外国貨物が災害その他やむを得ない事情により亡失した場合を除き、その運送の承認を受けた者がその関税を納める義務を負う。,○×,○,"保税運送の承認を受けて運送された外国貨物(輸出の許可を受けた貨物を除く。)が、その承認の際に指定された運送の期間内に運送先に到着しないときは、当該外国貨物が災害その他やむを得ない事情により亡失した場合又はあらかじめ税関長の承認を受けて滅却された場合を除き、その運送の承認を受けた者がその関税を納める義務を負う(関税法65条1項)。
本問は亡失を理由として期間内に到着しないときについて述べているので、正しい。"
関税法（関税の確定・納付）,57-17-5,関税法第63条の2第1項(保税運送の特例)に規定する特定保税運送に係る外国貨物(輸出の許可を受けた貨物を除く。)が亡失したことにより、その発送の日の翌日から起算して7日以内に運送先に到着しないときは、当該外国貨物が災害その他やむを得ない事情により亡失した場合を除き、その特定保税運送に係る特定保税運送者がその関税を納める義務を負う。,○×,○,"特定保税運送に係る外国貨物が発送の日の翌日から起算して7日以内に運送先に到着しないときは、特定保税運送者から、直ちにその関税を徴収する。ただし、当該貨物が災害その他やむを得ない事情により亡失した場合又はあらかじめ税関長の承認を受けて滅却された場合は、関税は徴収されない(関税法65条1項2項)。
本問は亡失を理由として期間内に到着しないときについて述べているので、正しい。"
関税法（関税の確定・納付）,57-18-1,税関長は、納税義務者が偽りその他不正の行為により関税を免れたと認められる場合において、納付すべき税額の確定した関税でその納期限までに完納されないと認められるものがあるときは、その納期限を繰り上げ、その納付を請求することができることとされている。,○×,○,①国税通則法38条1項各号の繰上請求に該当し、かつ、②納付すべき税額の確定した関税がその納期限までに完納されないと認められる場合又は特例申告貨物につき納付すべき関税（納付すべき税額が確定したものを除く。）でその確定後においては当該関税の徴収を確保することができないと認められるものがある場合においては、その納期限を繰り上げ、その納付を請求することができる(関税法11条)。つまり①②を満たせば納期限を早めることができるのだが、通関士試験との関係ではかなりマイナーな規定である。
関税法（関税の確定・納付）,57-18-2,金地金その他の貴金属であって換価の容易なものは、関税の担保として提供することが認められる。,○×,×,金地金（きんじがね）とは金塊のことである。金地金やその他の貴金属は関税の担保として認められない(関税法9条の11、国税通則法50条)。
関税法（関税の確定・納付）,57-18-3,関税の担保を提供した者は、担保物を変更する場合において、変更後に提供しようとする担保物が変更前の担保物の価額に相当する金銭であるときは、その旨を税関長に届け出ることとされているが、変更後に提供しようとする担保物が金銭以外のものであるときは、税関長の承認を受けなければならないこととされている。,○×,×,関税の担保を提供した者は、変更前や変更後の担保の種類にかかわらず、担保物や保証人を変更する場合は税関長の承認を受けなければならない(関税法9条の11、同法施行令8条の3第3項)。
関税法（関税の確定・納付）,57-18-4,税関長が、特許権に係る輸入差止申立てを受理した場合において、その申立てに係る貨物についての認定手続が終了するまでの間当該貨物が輸入されないことにより当該貨物を輸入しようとする者が被るおそれがある損害の賠償を担保するため、当該申立てをした特許権者に対し、相当と認める額の金銭をその指定する供託所に供託すべき旨を命じたときは、当該特許権者は、その特許権を目的として設定した質権をもって当該金銭に代えることができる。,○×,×,"輸入差止申立ての際に相当と認める額の金銭の供託を命じられたときは、金銭の代わりに、国債、地方債その他の有価証券で税関長が確実と認めるものを供託することができるので(関税法69の15第3項)、質権は対象となっていない。試験対策としてはここまで分かっていれば十分である。
有価証券の定義については色々と論争があるものの、財産的価値のある権利そのものが表れているチケットだと理解すればよい。国債や地方債の他、社債や株券等色々なものがある。質（しち）とは、担保となる物を質権者に預けておき、それを取り戻すためのお金が払えなければその物を質権者にあげることになる制度である。質権者は、取り戻すためのお金を払ってもらうまでは物を返さなくていいし、払ってもらえなければ物を貰えるという権利を持ち、この権利を質権という(民法342条)。質権という権利自体は財産的価値があるものの、チケットではなく概念なので、有価証券ではない。かなり大ざっぱな説明なので、詳しく知りたいのであれば各自で調べてほしい。"
関税法（関税の確定・納付）,57-18-5,税関長は、税関の当該職員に輸入者に対し実地の調査において関税法第105条第1項第6号の規定による質問検査等を行わせる場合には、あらかじめ、当該輸入者に対し、その調査を行う旨、調査を開始する日時、調査を行う場所、調査を行う理由、調査の対象となる期間等を口頭ではなく書面により通知しなければならない。,○×,×,"税関職員は、関税法、関税定率法その他関税に関する法律で政令で定めるものの規定により職務を執行するため必要があるときは、その必要と認められる範囲内において、関税法105条1項に掲げられた行為をすることができる。同項6号では、輸入された貨物についてその輸入者等に質問することや、貨物や貨物についての帳簿書類等を検査すること等ができるとされているが、税関職員が事業所等に直接やってきてこれらを行う場合は実地の調査という。
税関長が税関職員に実地の調査において質問や検査等を行わせる場合には、あらかじめ、輸入者に対し、その調査を行う旨、調査を開始する日時、調査を行う場所、調査を行う理由、調査の対象となる期間等を通知しなければならないが、書面により通知しなければならないという規定は存在しない(関税法105条の2、同法基本通達105の2-3、国税通則法74条の9)。
かなり細かい規定からの出題である。"
関税法（輸出通関）,57-19-1,経済連携協定の規定に基づき我が国の原産品とされる貨物を当該経済連携協定の締約国に輸出しようとする者は、当該貨物の輸出申告の際に、当該貨物が我が国の原産品であることにつき、我が国の権限ある当局が証明した書類を税関長に提出しなければならない。,○×,×,貨物を輸入する際に経済連携協定における関税についての特別の規定による便益（つまりEPA税率）を適用しようとする場合であれば、締約国原産地証明書のような原産地を証明する書類の提出を要するが、輸出の際には日本において関税がかからないのでこのような書類の提出は不要となる(関税法68条、同法施行令61条)。
関税法（輸出通関）,57-19-2,輸入の許可を受けた貨物について、保税地域から引き取ることなく外国に向けて送り出す場合には、関税法の規定に基づく輸出の手続を要しない。,○×,×,輸入の許可を受けた貨物は内国貨物なので(関税法2条1項3号)、内国貨物を外国に向けて送り出すことは輸出であるから(同項2号)、関税法の規定に基づく輸出の手続を要する(同法67条)。
