カテゴリー,問題番号,問題,選択肢,正解,解説
関税法（定義）,52-1-1,関税法2条の「輸入」とは、外国から本邦に到着した貨物(外国の船舶により(イ)で採捕された水産物を含む。)又は(ロ)を受けた貨物を本邦に（(ハ)を経由するものについては、(ハ)を経て本邦に）引き取ることをいう。,"1.(イ)接続水域 (ロ)輸出の許可 (ハ)保税蔵置場
2.(イ)領海 (ロ)輸入の許可 (ハ)保税蔵置場
3.(イ)領海 (ロ)輸出の許可 (ハ)指定保税地域
4.(イ)公海 (ロ)輸出の承認 (ハ)保税地域
5.(イ)公海 (ロ)輸出の許可 (ハ)保税地域",5,「輸入」とは、外国から本邦に到着した貨物（外国の船舶により公海で採捕された水産物を含む。）又は輸出の許可を受けた貨物を本邦に（保税地域を経由するものについては、保税地域を経て本邦に）引き取ることをいう(関税法2条1項1号)。
関税法（定義）,52-1-2,"「附帯税」とは、関税のうち延滞税、過少申告加算税、無申告加算税及び(ニ)をいう。
「開港」とは、貨物の輸出及び輸入並びに(ホ)の入港及び出港その他の事情を勘案して政令で定める港をいう。","1.(ニ)重加算税 (ホ)外国往来船
2.(ニ)重加算税 (ホ)外国貿易船
3.(ニ)利子税 (ホ)外国往来船
4.(ニ)利子税 (ホ) 沿海通航船",2,「附帯税」とは、関税のうち延滞税、過少申告加算税、無申告加算税及び重加算税をいう(関税法4条1項4号の2)。「開港」とは、貨物の輸出及び輸入並びに外国貿易船の入港及び出港その他の事情を勘案して政令で定める港をいう(同条項11号)。
関税法（関税の確定・納付）,52-2-1,"関税は、関税法又は関税定率法その他関税に関する法律に別段の規定がある場合を除くほか、(イ)が、これを納める義務がある。
特定保税運送に係る外国貨物で、その発送の日の翌日から起算して7日以内に運送先に到着しないものについて、関税を課する場合には、(ロ)がその関税を納める義務を負う。
関税定率法第15条第1項(特定用途免税)の規定により関税の免除を受けて輸入された貨物で、その免除に係る特定の用途以外の用途に供するため譲渡されたものについて、その免除を受けた関税を徴収する場合には、その(ハ)がその関税を納める義務を負う。","1.(イ)貨物を輸入する者 (ロ)特定保税運送者 (ハ)譲渡をした者
2.(イ)貨物を輸入する者 (ロ)貨物を運送する者 (ハ)貨物の占有者
3.(イ)貨物を輸入する者 (ロ)貨物を運送する者 (ハ)貨物の所有者
4.(イ)輸入の許可を受けた者 (ロ)特定保税運送者 (ハ)貨物の占有者
5.(イ)輸入の許可を受けた者 (ロ)貨物を運送する者 (ハ)譲渡をした者",1,関税は、この法律又は関税定率法その他関税に関する法律に別段の規定がある場合を除く外、貨物を輸入する者が、これを納める義務がある(関税法6条)。特定保税運送に係る外国貨物が発送の日の翌日から起算して7日以内に運送先に到着しないときは、特定保税運送者から、直ちにその関税を徴収する(同法65条2項)。関税定率法第15条第1項(特定用途免税)の規定により関税の免除を受けて輸入された貨物で、その免除に係る特定の用途以外の用途に供するため譲渡されたものについて、その免除を受けた関税を徴収する場合には、その譲渡をした者がその関税を納める義務を負う(同条2項本文)。
関税法（関税の確定・納付）,52-2-2,"保税蔵置場にある外国貨物で亡失したものについて、関税を課する場合には、(ニ)がその関税を納める義務を負う。
船用品として外国貿易船に積み込むことについて税関長の承認を受けた外国貨物で、その承認の際に税関長が指定した期間内に当該外国貿易船に積み込まれなかったものについて、関税を課する場合には、(ホ)がその関税を納める義務を負う。","1.(ニ)外国貨物を亡失させた者 (ホ)船用品の所有者
2.(ニ)外国貨物を亡失させた者 (ホ)外国貿易船の船長
3.(ニ)保税蔵置場の許可を受けた者 (ホ)積込みの承認を受けた者
4.(ニ)外国貨物を亡失させた者 (ホ)貨物の所有者
5.(ニ)外国貨物を亡失させた者 (ホ)貨物の占有者",3,保税蔵置場にある外国貨物が亡失したときは、当該保税蔵置場の許可を受けた者から、直ちにその関税を徴収する(関税法45条1項本文)。船用品として外国貿易船に積み込むことの承認を受けた船用品がその承認の際に税関長が指定した期間内に当該外国貿易船に積み込まれなかったものについては、積込みの承認を受けた者から、直ちにその関税を徴収する(同法23条6項本文)。 
関税法（関税の確定・納付）,52-3-1,"納税申告をした者は、当該納税申告により納付すべき税額に(イ)がある場合には、当該納税申告について税関長の更正があるまでは、修正申告をすることができる。
税関長の承認を受けて輸入の許可前に引き取られた貨物に係る更正の請求は、当該承認の日の翌日から起算して(ロ)を経過する日と(ハ)とのいずれか遅い日までの間に限り行うことができる。","1.(イ)超過額 (ロ)5年 (ハ)輸入申告の日
2.(イ)不足額 (ロ)5年 (ハ)輸入の許可の日
3.(イ)不足額 (ロ)3年 (ハ)貨物引き取りの日
4.(イ)誤り (ロ)1年 (ハ)輸入申告の日
5.(イ)誤り (ロ)5年 (ハ)輸入の許可の日",2,納税申告をした者は、当該納税申告により納付すべき税額に不足額がある場合には、当該納税申告について税関長の更正があるまでは、修正申告をすることができる(関税法7条の14第1項1号)。税関長の承認を受けて輸入の許可前に引き取られた貨物に係る更正の請求は、当該承認の日の翌日から起算して5年を経過する日と輸入の許可の日とのいずれか遅い日までの間に限り行うことができる(同法7条の15第1項)。
関税法（関税の確定・納付）,52-3-2,税関長は、納税申告が必要とされている貨物についてその輸入の時までに当該納税申告がないときは、その(ニ)により、当該貨物に係る課税標準又は納付すべき税額を決定することとされており、その決定は、(ホ)を送達して行うこととされている。,"1.(ニ)確認 (ホ)納税告知書
2.(ニ)調査 (ホ)納税告知書
3.(ニ)調査 (ホ)決定通知書
4.(ニ)職権 (ホ)納税告知書
5.(ニ)職権 (ホ)決定通知書",3,税関長は、納税申告が必要とされている貨物についてその輸入の時までに当該納税申告がないときは、その調査により、当該貨物に係る課税標準又は納付すべき税額を決定することとされており、その決定は、決定通知書を送達して行うこととされている(関税法7条の16第2項4項)。
関税法（輸入通関）,52-4-1,"貨物を輸入しようとする者は、当該貨物の(イ)並びに課税標準となるべき数量及び価格(特例申告に係る貨物については数量及び価格)その他必要な事項を税関長に申告し、貨物につき必要な(ロ)を経て、その許可を受けなければならない。
本邦に本店又は主たる事務所を有しない法人である輸入申告を行うべき者が本邦にその事務所及び事業所を有せず、又は有しないこととなる場合において、輸入申告を行う必要があるときは、その者は、当該輸入申告を行わせるため、本邦に本店又は主たる事務所を有する者で当該輸入申告を行うことにつき便宜を有するもののうちから(ハ)を定めなければならない。","1.(イ)形状 (ロ)検査 (ハ)通関代理人
2.(イ)品名 (ロ)検査 (ハ)税関事務管理人
3.(イ)種類 (ロ)確認 (ハ)通関代理人
4.(イ)品名 (ロ)確認 (ハ)税関事務管理人
5.(イ)種類 (ロ)審査 (ハ)納税管理人",2,貨物を輸入しようとする者は、当該貨物の品名並びに課税標準となるべき数量及び価格(特例申告に係る貨物については数量及び価格)その他必要な事項を税関長に申告し、貨物につき必要な検査を経て、その許可を受けなければならない(関税法67条)。本邦に本店又は主たる事務所を有しない法人である輸入申告を行うべき者が本邦にその事務所及び事業所を有せず、又は有しないこととなる場合において、輸入申告を行う必要があるときは、その者は、当該輸入申告を行わせるため、本邦に本店又は主たる事務所を有する者で当該輸入申告を行うことにつき便宜を有するもののうちから税関事務管理人を定めなければならない(同法95条1項)。 
関税法（輸入通関）,52-4-2,"輸入申告を行うべき者は、税関事務管理人を定めたとき、又はその定めた税関事務管理人を(ニ)したときは、当該税関事務管理人に係る輸入申告に係る税関長にその旨を届け出なければならない。
輸入申告を行った税関事務管理人は、当該輸入申告に係る輸入申告を行うべき者が関税法の規定により保存すべきこととされている(ホ)について、税関長から提示を求められた場合には、当該税関長に当該(ホ)を提示しなければならない。","1.(ニ)解任 (ホ)帳簿及び書類
2.(ニ)弾劾 (ホ)委託契約書類
3.(ニ)弾劾 (ホ)輸入申告書
4.(ニ)再任 (ホ)帳簿及び書類
5.(ニ)再任 (ホ)輸入申告書",1,輸入申告を行うべき者は、税関事務管理人を定めたとき、又はその定めた税関事務管理人を解任したときは、当該税関事務管理人に係る輸入申告に係る税関長にその旨を届け出なければならない(関税法95条2項)。輸入申告を行った税関事務管理人は、当該輸入申告に係る輸入申告を行うべき者が関税法の規定により保存すべきこととされている帳簿及び書類について、税関長から提示を求められた場合には、当該税関長に当該帳簿及び書類を提示しなければならない(同条3項)。 ※(ホ)は、出題当時においては「帳簿書類」とされていたのだが、令和4年は関税法において納税に関する帳簿の呼び方も変わったものがあることから、現在では「帳簿及び書類」とされる。紙の帳簿・書類が電子データの帳簿・書類に変わったことによるものであり、内容自体が全然違うというわけではないのであまり気にしなくてよい。
関税定率法（軽減・免除・払戻し）,52-5-1,関税定率法第11条に規定する減税の対象となる貨物は、加工又は修繕のため本邦から輸出され、その輸出の許可の日から(イ)（(イ)を超えることがやむを得ないと認められる理由がある場合において、政令で定めるところにより税関長の承認を受けたときは、(イ)を超え税関長が指定する期間）以内に輸入される貨物（(ロ)のものについては、(ハ)と認められるものに限る。）である。,"1.(イ)2年 (ロ)組立てのため (ハ)本邦の産業に実質的な損害を与えない
2.(イ)2年 (ロ)修繕のため (ハ)本邦においてその修繕をすることが困難である
3.(イ)1年 (ロ)修繕のため (ハ)本邦においてその修繕をすることが困難である
4.(イ)1年 (ロ)加工のため (ハ)本邦においてその加工をすることが困難である
5.(イ)6月 (ロ)加工のため (ハ)本邦においてその加工をすることが困難である",4,関税定率法第11条に規定する減税の対象となる貨物は、加工又は修繕のため本邦から輸出され、その輸出の許可の日から1年（1年を超えることがやむを得ないと認められる理由がある場合において、政令で定めるところにより税関長の承認を受けたときは、1年を超え税関長が指定する期間）以内に輸入される貨物（加工のためのものについては、本邦においてその加工をすることが困難であると認められるものに限る。）である。
関税定率法（軽減・免除・払戻し）,52-5-2,関税定率法第11条の規定により関税の軽減を受けようとする貨物を輸出しようとする者は、税関長が当該貨物の(ニ)のため必要と認めて指示したときは、その輸出の際に、(ホ)その他の(ニ)のための措置をとらなければならない。,"1.(ニ)加工又は修繕の明細の確認 (ホ)当該貨物に係る加工又は修繕のために輸出する旨を証する書類の提出
2.(ニ)再輸入の確認 (ホ)当該貨物につき記号の表示
3.(ニ)関税の軽減額の計算 (ホ)当該貨物に係る関税の軽減額の計算の基礎を記載した明細書の提出
4.(ニ)関税の軽減額の計算 (ホ)当該貨物につき記号の表示",2,関税定率法第11条の規定により関税の軽減を受けようとする貨物を輸出しようとする者は、税関長が当該貨物の再輸入の確認のため必要と認めて指示したときは、その輸出の際に、当該貨物につき記号の表示その他の再輸入の確認のための措置をとらなければならない(同法施行令5条2項)。
関税法（輸入通関）,52-6-1,特例輸入者は、電子情報処理組織(NACCS)を使用することなく輸入申告を行う場合であっても、税関長の承認を受けることなく、その申告に係る貨物を保税地域に入れないで輸入申告を行うことができる。,○×,×,特例輸入者は、電子情報処理組織(NACCS)を使用して輸入申告を行う場合に限り、税関長の承認を受けることなく、申告に係る貨物を保税地域に入れずに輸入申告を行うことができる(関税法67条の2第3項3号、同法施行令59条の6第3項)。
関税法（輸入通関）,52-6-2,外国貿易船に積み込んだ状態で輸入申告をすることが必要な貨物を輸入しようとする者は、税関長の承認を受けて、当該外国貿易船の係留場所を所轄する税関長に対して輸入申告をすることができる。,○×,○,いわゆる本船扱いのことであり、関税法67条の2第2項、同法施行令59条の5第1項1号にその通りの規定がある。
関税法（輸入通関）,52-6-3,税関長は、輸入申告があった場合において、関税についての条約の特別の規定による便益を適用する場合において必要があるときは、当該便益を適用するために必要な書類を提出させることができる。,○×,○,関税法68条にその通りの規定がある。関税についての条約の特別の規定による便益とは、経済連携協定（EPA）のことである。輸入者がEPA税率を適用したいのなら、税関長は、適用のために必要な書類を提出させることができる。
関税法（輸入通関）,52-6-4,特例輸入者は、電子情報処理組織(NACCS)を使用することなく輸入申告を行う場合であっても、その申告に係る貨物を入れる保税地域の所在地を所轄する税関長以外のいずれかの税関長に対して、輸入申告をすることができる。,○×,×,特例輸入申告はNACCSを使用して行わなければならないのが原則であり、NACCSを使用せずに輸入申告を行うのならば、特例輸入者が行う申告であっても通常の輸入申告として行うことになるため、その申告に係る貨物を入れる保税地域等の所在地を所轄する税関長に対してしなければならない(関税法67条の2第1項、67条の19、同法施行令59条の20第2項)。
関税法（原産地表示）,52-6-5,税関長は、原産地について誤認を生じさせる表示がされている外国貨物については、当該表示がある旨をその輸入申告をした者に直ちに通知し、期間を指定して、その者の選択により、その表示を消させ、若しくは訂正させ、又は当該貨物を積み戻させなければならない。,○×,○,原産地について直接・間接に偽った表示又は誤認を生じさせる表示がされている外国貨物については、税関長は、輸入を許可しない。そして、税関長は、このような表示がされている外国貨物について、当該表示がある旨をその輸入申告をした者に直ちに通知し、期間を指定して、その者の選択により、その表示を消させ、若しくは訂正させ、又は当該貨物を積み戻させなければならない(関税法71条)。
関税法（他法令の証明・確認）,52-7-1,課税価格の総額が20万円以下の貨物を輸入しようとする場合には、他法令確認を要することはない。,○×,×,課税価格により他法令確認を免除する規定はない(関税法70条参照)。
関税法（他法令の証明・確認）,52-7-2,輸入される郵便物であっても他法令確認を要することがある。,○×,○,信書(お手紙のこと)以外の郵便物は他法令確認を要する(関税法76条4項、1項ただし書、70条)
関税法（他法令の証明・確認）,52-7-3,本邦に入国する者がその入国の際に携帯して輸入する物品のうち、その個人的な使用に供するものについては、他法令確認を要することはない。,○×,×,このような物品について他法令確認を免除する規定はない(関税法70条参照)。
関税法（他法令の証明・確認）,52-7-4,特定輸出申告に係る貨物を輸出しようとする場合であっても他法令確認を要することがある。,○×,○,特定輸出申告に係る貨物だという理由で他法令確認を免除する規定はない(関税法70条参照)。
関税法（他法令の証明・確認）,52-7-5,総合保税地域における保税作業による製品である外国貨物を外国に向けて積み戻す場合には、他法令確認を要することはない。,○×,×,外国貨物の積戻しには、原則他法令確認を要する(関税法75条1項、70条)。
関税法（輸入通関）,52-8-1,オーストラリア税率の適用を受けようとする貨物について、関税法第73条第 1 項の規定に基づき輸入の許可前における貨物の引取りの承認を受ける場合における原産品申告書の提出は、当該貨物に係る輸入申告後相当と認められる期間内にしなければならない。,○×,○,"経済連携協定における締約国原産地証明書、締約国原産品申告書等及び締約国品目証明書は、原則として輸入申告の際に提出する。例外的に、①簡易手続の対象となる郵便物については税関職員による検査その他郵便物に係る税関の審査の際に、②税関長が災害その他やむを得ない理由があると認める場合はその申告又は審査後相当と認められる期間内に、③輸入許可前引取承認を受ける場合には、その申告又は審査後相当と認められる期間内に、それぞれ提出しなければならない(関税法施行令61条4項本文)。本問は③について述べたものであり、正しい。

なお、締約国品目証明書は、これに係る貨物の課税価格の総額が20万円以下である場合においては、税関長の求めがあったときに提出すればよい(同項ただし書)。"
関税法（輸入通関）,52-8-2,オーストラリア税率の適用を受けようとする貨物の課税価格の総額が25万円以下の場合には、原産品申告書の提出を要しない。,○×,×,25万円以下ではなく、20万円以下である（関税法68条、同法施行令61条1項2号イ）。
関税法（輸入通関）,52-8-3,オーストラリア協定に基づく原産品申告書は、これに係る貨物の輸入申告の日において、その作成の日から6月以上を経過したものであってはならない。,○×,×,「6月」ではなく「1年」である(関税法施行令61条5項本文)。
関税法（輸入通関）,52-8-4,オーストラリア協定に基づく原産品申告書とは、オーストラリアの発給機関が、オーストラリアに所在する輸出者又は生産者による申請に基づき、発給したものをいう。,○×,×,オーストラリア協定に基づく原産品申告書は、輸入者、輸出者又は生産者のいずれかが自ら作成したものである(関税法施行令61条1項2号イ(2)、オーストラリア協定3.16条)。
関税法（輸入通関）,52-8-5,オーストラリア税率の適用を受けようとする貨物について、関税法第43条の3第1項の規定に基づき外国貨物を置くことの承認を受けようとする場合における原産品申告書の提出は、災害その他やむを得ない理由があると税関長が認める場合を除き、当該承認の申請の際にしなければならない。,○×,○,オーストラリア税率の適用を受けようとする貨物について、外国貨物を置くことの承認を受ける場合には、当該貨物に係る原産品申告書は、災害その他やむを得ない理由があると税関長が認める場合を除き、当該承認申請の際に税関長に提出しなければならない(同法第43条の3第1項、同法施行令第36条の3第3項)。なお、この場合においては、当該貨物の輸入申告の際には、原産品申告書の提出を要しない(同項)。
関税法（運送）,52-9-1,外国貨物である難破貨物をその所在する場所から開港に外国貨物のまま運送する場合においては、その所在する場所に税関が設置されておらず、当該運送をすることについて緊急な必要があるときであっても、当該運送について、その所在する場所を所轄する税関長の承認を受けなければならない。,○×,×,外国貨物である難破貨物をその所在する場所から開港等に運送する場合には、原則として税関長の承認を受けなければならないが、税関が設置されていない場所から運送をすることについて緊急な必要がある場合において税関職員がいないときは、例外的に警察官にあらかじめその旨を届け出ることにより運送することができる(関税法第64条1項1号)。
関税法（運送）,52-9-2,日本郵便株式会社は、輸入される郵便物で関税法第76条の規定により日本郵便株式会社から税関長に提示され、税関職員による必要な検査が行われ、当該検査が終了したことについて税関長から日本郵便株式会社に通知があったものについて、税関空港相互間を運送しようとする場合には、税関長の承認を受けなければならない。,○×,×,"輸入される郵便物で関税法76条の規定により日本郵便株式会社から税関長に提示され、税関職員による必要な検査が行われ、当該検査が終了したことについて税関長から日本郵便株式会社に通知があったものというのは、特定郵便物のことを指している。
特定郵便物を除く郵便物については、特定区間（開港、税関空港、保税地域、税関官署等の相互間）に限り、税関長の承認を受けることなく、税関長に届け出て、外国貨物のまま運送することができる(関税法63条の9第1項)。つまり、承認を受けなければならないのではなく、届出でよい。しかし特定郵便物については、保税運送の承認も届出も必要とされていない(63条1項、63条の9第1項)。特定郵便物は外国貨物であっても保税地域以外の場所に置くことができるので(30条1項3号)、運送のため保税地域外に出してもよいのである。
よって、本問では、税関長の承認を受けずに税関空港相互間を運送できる。"
