カテゴリー,問題番号,問題,選択肢,正解,解説
関税法（輸出してはならない貨物）,52-15-1,著作権を侵害する物品であっても、出国する者がその出国の際に携帯して輸出するものである場合には、輸出してはならない貨物に該当しない。,○×,×,著作権を侵害する物品であって、その侵害とみなされる行為をした場合には、出国する者がその出国の際に携帯して輸出するものであっても、輸出してはならない貨物に該当する。出国の際に携帯して輸出するからといって例外は無い(関税法69条の2第1項3号)。 
関税法（輸出してはならない貨物）,52-15-2,輸出してはならない貨物について、税関長は、商標権を侵害する貨物に該当するか否かについての認定手続において、その認定をするために必要があると認めるときは、専門委員に対し、当該認定のための参考となるべき意見を求めることができる。,○×,○,税関長は、特許権、実用新案権、意匠権、商標権、著作権又は著作隣接権を侵害する貨物に該当するか否かについての認定手続において、その認定をするために必要があると認めるときは、知的財産権に関し学識経験を有する者であってその認定手続に係る事案の当事者と特別の利害関係を有しないものを専門委員として委嘱し、当該認定のための参考となるべき意見を求めることができる。ただし、技術的範囲等については、意見を求めることはできない(関税法69条の9、69条の2第1項3号)。
関税法（輸出してはならない貨物）,52-15-3,税関長は、輸出されようとする貨物のうちに意匠権を侵害する物品に該当する貨物があると思料するときは、その意匠権に係る輸出差止申立てが行われている場合に限り、認定手続を執ることができる。,○×,×,税関長は、輸出されようとする貨物のうちに意匠権を侵害する物品に該当する貨物があると思料するときは、その意匠権に係る輸出差止申立てが行われているかどうかに拘わらず、認定手続を執らなければならない(関税法69条の3第1項)。というよりそもそも、輸出差止申立て手続において認定手続が行われるので(同法69条の4第1項)、輸出差止申立てが行われていれば認定手続も行われている。
関税法（輸出してはならない貨物）,52-15-4,税関長は、輸出されようとする貨物のうちに商標権を侵害する物品に該当する貨物があると思料するときは、認定手続を執ることなく、当該貨物を没収して廃棄することができる。,○×,×,税関長は、商標権を侵害する物品に該当する貨物があると思料するときは、認定手続を経た後でなければ、没収して廃棄することはできない(関税法第69条の3第4項、同法69条の2第2項)。
関税法（輸出してはならない貨物）,52-15-5,税関長は、輸出差止申立てを受理した場合において、当該申立てに係る貨物についての認定手続が終了するまでの間、当該貨物が輸出されないことにより当該貨物を輸出しようとする者が被るおそれがある損害の賠償を担保するため必要があると認めるときは、当該申立てをした者に対し、期限を定めて、相当と認める額の金銭をその指定する供託所に供託すべき旨を命ずることができる。,○×,○,関税法69条の6第1項にその通りの規定がある。ちなみに、供託所というのはお金などを預かる役所である。紛争が起きたときに担保となるお金などを預けておくことができる。本問のような事例であれば、輸出差止申立てがあった場合、輸出者は一定期間対象貨物を輸出できなくなり損害を被るおそれがあるが、もしその申立てが輸出者への嫌がらせ目的だったりすれば、申立人は後で損害を賠償しなければならない。その場合、申立人にお金がなくてやっぱり輸出者へ賠償できませんよと言わせないため先に担保を提供させるのだが、そこで担保を信頼して預けられる機関が供託所である。
関税法（関税の確定・納付）,52-16-1,特例輸入者が保税地域に入れることなく電子情報処理組織(NACCS)を使用して輸入申告をした貨物であって、輸入の許可を受けたものについては、当該輸入申告の日において適用される法令による。,○×,×,「当該輸入申告の日」ではなく「当該輸入の許可の時の属する日」である(関税法5条1号、同法4条1項5号の3)。
関税法（関税の確定・納付）,52-16-2,機用品として航空機に積み込むことについて税関長の承認を受けた外国貨物で、その承認の際に税関長が指定する期間内に当該航空機に積み込まれないものについては、当該指定された積込みの期間が経過した時の属する日において適用される法令による。,○×,×,「当該指定された積込みの期間が経過した時の属する日」ではなく「当該積込みが承認された時の属する日」である(関税法5条1号、同法4条1項5号)。
関税法（関税の確定・納付）,52-16-3,賦課課税方式が適用される郵便物であって日本郵便株式会社から税関長に提示がされたものについては、当該提示がされた時の属する日において適用される法令による。,○×,○,賦課課税方式が適用される郵便物であって日本郵便株式会社から税関長に提示がされたものについては、当該提示がされた時の属する日において適用される法令による(関税法5条1号、同法4条1項6号)。
関税法（関税の確定・納付）,52-16-4,収容された外国貨物で、公売に付されるものについては、当該収容の時の属する日において適用される法令による。,○×,×,「当該収容の時の属する日」ではなく「当該公売の時の属する日」である(関税法5条1号、同法4条1項7号)。
関税法（関税の確定・納付）,52-16-5,保税蔵置場に置かれた外国貨物で、輸入申告がされた後輸入の許可がされる前に当該貨物に適用される法令の改正があったものについては、その保税蔵置場に置くことが承認された日において適用される法令による。,○×,×,「その保税蔵置場に置くことが承認された日」ではなく「当該許可の日」である(関税法5条2号)。
関税法（関税の確定・納付）,52-17-1,"（※関税の納期限に関する問題である。）
無申告加算税に係る賦課決定通知書を受けた者は、当該通知書に記載された金額の無申告加算税を当該通知書が発せられた日の翌日から起算して1月を経過する日までに納付しなければならない。",○×,○,無申告加算税又はその重加算税（無申告重加算税）に係る賦課決定通知書を受けた者は、当該通知書に記載された金額の無申告加算税又は無申告重加算税を当該通知書が発せられた日の翌日から起算して1月を経過する日までに納付しなければならない(関税法9条4項)。
関税法（関税の確定・納付）,52-17-2,"（※関税の納期限に関する問題である。）
期限内特例申告書に記載された納付すべき税額については、特例申告書の提出期限までに納付しなければならない。",○×,○,関税法9条2項1号にその通りの規定がある。なお、特例申告書の提出期限は、輸入の許可の日の属する月の翌月末日である(同法7条の2第2項)。
関税法（関税の確定・納付）,52-17-3,"（※関税の納期限に関する問題である。）
輸入の許可後にされた更正に係る更正通知書に記載された納付すべき税額については、当該更正通知書が発せられた日の翌日から起算して1月を経過する日までに納付しなければならない。",○×,○,輸入の許可後にされた更正に係る更正通知書に記載された納付すべき税額については、当該更正通知書が発せられた日の翌日から起算して1月を経過する日までに納付しなければならない(関税法9条2項5号)。
関税法（関税の確定・納付）,52-17-4,"（※関税の納期限に関する問題である。）
過少申告加算税に係る賦課決定通知書を受けた者は、当該通知書に記載された金額の過少申告加算税を当該通知書が発せられた日の翌日から起算して1月を経過する日と当該過少申告加算税の納付の起因となった関税に係る貨物の輸入の許可の日とのいずれか遅い日までに納付しなければならない。",○×,○,過少申告加算税又はその重加算税（過少申告重加算税）に係る賦課決定通知書を受けた者は、当該通知書に記載された金額の過少申告加算税又は過少申告重加算税を当該通知書が発せられた日の翌日から起算して1月を経過する日と当該過少申告加算税の納付の起因となった関税に係る貨物の輸入の許可の日とのいずれか遅い日までに納付しなければならない(関税法9条3項)。
関税法（関税の確定・納付）,52-17-5,"（※関税の納期限に関する問題である。）
申告納税方式が適用される貨物を輸入しようとする者が輸入申告に併せて納税申告を行った場合において、当該申告に係る関税を納付すべき期限に関し、その延長を受けたい旨の申請書を当該申告に係る税関長に提出し、かつ、当該関税の額の一部に相当する額の担保を当該税関長に提供したときは、当該税関長は、当該提供された担保の額を超えない範囲内において、その納期限を2月以内に限り延長することができる。",○×,×,「2月以内」ではなく「3月以内」である(関税法9条の2第1項)。
関税法（輸出通関）,52-18-1,本邦の船舶により公海で採捕された水産物を洋上から直接外国に向けて送り出す場合には、関税法に基づく輸出の手続を要する。,○×,○,本邦の船舶により公海で採捕された水産物は内国貨物であるから、その貨物を洋上から外国に向けて送り出すことは輸出となるため、関税法に基づく輸出の手続(輸出申告等)を要する(関税法67条、2条1項2号4号)。
関税法（輸出通関）,52-18-2,外国貿易船に積み込んだ状態で輸出申告をすることが必要な貨物について、特定委託輸出申告を行う場合には、本船扱いの手続を要することなく特定委託輸出申告を行うことができる。,○×,○,貨物を外国貿易船に積み込んだ状態で輸出申告をする場合（本船扱い）には、原則として税関長の承認を受けて本船扱いの手続をしなければならないが(関税法67条の2第2項)、このような貨物について特定委託輸出申告を行う場合には、本船扱いの手続を要しない(同法67条の3第1項、同法基本通達67の2-1本文)。 
関税法（輸出通関）,52-18-3,輸出申告書に記載すべき貨物の数量は、財務大臣が貨物の種類ごとに定める単位による当該貨物の正味の数量とされている。,○×,○,輸出申告書には貨物の数量を記載する必要があるが、その数量は、財務大臣が貨物の種類ごとに定める単位による当該貨物の正味の数量とされている(関税法第67条、同法施行令第58条1号、59条の2第1項)。
関税法（輸出通関）,52-18-4,貨物(本邦から出国する者がその出国の際に携帯して輸出する貨物及び郵便物並びに特定輸出貨物を除く。)を業として輸出する者は、輸出申告に際して税関に提出したものを除き、当該貨物に係る製造者又は売渡人の作成した仕出人との間の取引についての書類を、当該貨物の輸出の許可の日の翌日から5年間保存しなければならない。,○×,○,関税法第94条1項2項、同法施行令61条1項、同令83条4項8項にその通りの規定がある。なお、令和4年法改正により、貨物に係る取引に関して作成し又は受領した書類その他の書類で政令で定めるものを「関税関係書類」と呼ぶこととなるため、本問中の「当該貨物に係る製造者又は売渡人の作成した仕出人との間の取引についての書類」も関税関係書類の一種なので、今後はそこの関係を理解していることを前提に作問される可能性もあるので注意。 
関税法（輸出通関）,52-18-5,特定委託輸出者が特定委託輸出申告を行う場合において、その申告に係る貨物が置かれている場所から当該貨物を外国貿易船に積み込もうとする開港までの運送については、当該申告に係る輸出の許可後を含め、一の特定保税運送者が一貫して行わなければならない。,○×,×,特定委託輸出者が特定委託輸出申告を行う場合において、その申告に係る貨物が置かれている場所から当該貨物を外国貿易船に積み込もうとする開港までの運送については、特定保税運送者に委託しなければならない(関税法67条の3第1項)。そして、この運送は原則として一の特定保税運送者が一貫して行わなければならないが、輸出の許可を得た後は例外的に他の特定保税運送者が運送を行うことができる(同法基本通達67の3-2-2)。 
関税法（関税の確定・納付）,52-19-1,特例申告を行う場合は、特例申告貨物で輸入の許可を受けたものについて、特例申告書を作成し、当該許可の日の属する月の翌月末日までに当該許可をした税関長に提出しなければならない。,○×,○,特例申告を行う場合は、特例申告貨物で輸入の許可を受けたものについて、特例申告書を作成し、当該許可の日の属する月の翌月末日までに当該許可をした税関長に提出しなければならない(関税法7条の2第2項)。
関税定率法（定義、関税率、その他）,52-19-2,本邦に入国する者がその入国の際に携帯して輸入する貨物であって、その課税標準となる価格の合計額が20万円以下のものに対する関税の率は、関税定率法第3条の3の規定に基づき少額輸入貨物に対する簡易税率によらなければならない。,○×,×,本邦に入国する者が携帯して輸入する貨物に対する関税の率は、「入国者の輸入貨物に対する簡易税率」が適用される(関税定率法3条の2)。そして、本邦に入国する者が携帯して輸入する貨物については、同法3条の3による少額輸入貨物に対する簡易税率の規定は適用されない(3条の3第1項本文)。したがって、「関税定率法第3条の3の規定に基づき少額輸入貨物に対する簡易税率によらなければならない」という部分が誤りとなる。なお、同法3条の2第1項ただし書により、入国者が簡易税率の適用を希望しない場合には一般の税率が適用されることを理由として誤りとした解説を見たことがあるが、問われているのは3条の3が適用されるかどうかなので、このような理由で誤りとするのは不正確である。本邦に入国する者が携帯して輸入する貨物なら、3条の3が適用されるかどうかを検討する余地は無い。
関税法（保税地域）,52-19-3,輸入しようとする外国貨物で保税地域にあるものを、輸入者が輸入申告に際し見本として一時持ち出そうとする場合には、税関長の許可を受けなければならない。,○×,○,保税地域にある外国貨物を見本として一時持ち出そうとする者は、税関長の許可を受けなければならない(関税法32条)。なお、この許可を受けようとする者は、その許可を受けようとする貨物の記号、番号、品名及び数量、その置かれている場所並びに一時持出の期間、持出先及び事由を記載した申請書を税関長に提出しなければならない。ただし、税関長は、当該貨物の価額が極めて少ないこと等により提出の必要がないと認めるときは、口頭で申請させることができる(同法施行令27条)。
関税法（輸入通関）,52-19-4,輸出の許可を受けた貨物の全部について、外国に向けて送り出すことが取止めになり、当該貨物の全部を本邦に引き取る場合は、関税法に基づく輸入の手続を要する。,○×,○,輸出の許可を受けた貨物は外国貨物なので、その貨物の全部について外国に向けて送り出すことが取止めになり、本邦に引き取る場合は、輸入申告をしてその許可を受けることを要する(関税法67条、2条1項1号3号)。
関税法（輸入通関）,52-19-5,本邦の船舶により外国の排他的経済水域の海域で採捕された水産物を本邦に引き取る場合は、その水産物について、関税法に基づく輸入の手続を要しない。,○×,○,本邦の船舶により外国の排他的経済水域の海域で採捕された水産物は内国貨物であるため、当該貨物を本邦に引き取る行為は輸入に該当しないので、関税法に基づく輸入の手続を要しない(関税法2条1項4号、2項)。
関税法（附帯税）,52-20-1,修正申告が、その申告に係る関税についての調査があったことにより当該関税について更正があるべきことを予知してされたものでない場合において、その申告に係る関税についての調査に係る税関による事前通知がある前に行われたものであるときは、過少申告加算税は課されない。,○×,○,"過少申告加算税の税率は、加重分や優良な電子帳簿に係る軽減措置を除いた基本的な部分について、時系列で早い段階から順に並べると、

①調査通知前の修正申告
→課されない

②調査通知後～調査があったことにより更正があるべきことを予知するまでの修正申告
→5%

③ 調査があったことにより更正があるべきことを予知した後の修正申告
→10%

となる(関12条の2第1項、5項)。"
関税法（附帯税）,52-20-2,更正に基づき過少申告加算税が課される場合において、当該更正により納付すべき税額の計算の基礎となった事実のうちに、当該更正前の税額の計算の基礎とされていなかったことについて正当な理由があると認められるものがある場合には、当該更正により納付すべき税額からその正当な理由があると認められる事実に基づく税額として計算した金額を控除した税額を基礎として計算した過少申告加算税を課する。,○×,○,関税法12条の2第4項1号にその通りの規定がある。間違った低い金額で納税してしまうのも仕方がないといえるような理由（正当な理由）によって納税しなかった部分の金額については、納税者が可哀想だから過少申告加算税は課さないであげようとの趣旨である。
関税法（附帯税）,52-20-3,"過少申告加算税の額の計算の基礎となる税額が10,000円未満である場合においては、過少申告加算税は課さず、当該税額に10,000円未満の端数がある場合においては、これを切り捨てて計算する。",○×,○,"過少申告加算税の額の計算の基礎となる税額が10,000円未満である場合においては、過少申告加算税は課さず、当該税額に10,000円未満の端数がある場合においては、これを切り捨てて計算する(関税法12条の2第6項、同法12条3項)。"
関税法（附帯税）,52-20-4,"無申告加算税の額が5,000円未満である場合においては、これを徴収せず、当該無申告加算税の額に100円未満の端数がある場合においては、これを切り捨てる。",○×,○,"無申告加算税の額が5,000円未満である場合においては、これを徴収せず、当該無申告加算税の額に100円未満の端数がある場合においては、これを切り捨てる(関税法12条の3第7項、同法12条4項)。"
関税法（附帯税）,52-20-5,過少申告加算税が課される場合において、納税義務者が納付すべき税額の計算の基礎となるべき事実の全部又は一部を隠蔽し、その隠蔽したところに基づき納税申告をしていたときは、当該納税義務者に対し、過少申告加算税の額の計算の基礎となるべき税額に係る過少申告加算税に代え、当該基礎となるべき税額に100分の30の割合を乗じて計算した金額に相当する重加算税が課される。,○×,×,「100分の30の割合」（30%）ではなく「100分の35の割合」（35%）である(関税法12条の4第1項)。
関税法（保税地域）,52-21-1,保税蔵置場の許可を受けた者は、当該保税蔵置場の貨物の収容能力を増加しようとするときは、あらかじめ税関長の承認を受けなければならない。,○×,×,「あらかじめ税関長の承認を受けなければならない」ではなく「あらかじめその旨を税関に届け出なければならない」である(関税法44条1項)。 
関税法（保税地域）,52-21-2,保税蔵置場に外国貨物を置くことができる期間は、当該貨物を最初に保税蔵置場に入れた日から1年である。,○×,×,「最初に保税蔵置場に入れた日から1年」ではなく「最初に保税蔵置場に置くことが承認された日から2年」である(関税法43条の2第1項)。
関税法（保税地域）,52-21-3,保税蔵置場の許可を受けていた者が、当該許可に基づく地位を承継することにつきあらかじめ税関長の承認を受け、当該保税蔵置場の業務を譲り渡した場合において、その譲渡しの際、当該保税蔵置場に外国貨物があるときは、当該業務を譲り渡した者は、当該外国貨物を当該保税蔵置場から出し終わるまでは、当該保税蔵置場についての義務を免れることができない。,○×,×,保税蔵置場の許可を受けた者がその業務を譲り渡した場合において、当該許可に基づく地位を承継することにつきあらかじめ税関長の承認を受けたときは、当該保税蔵置場の業務を譲り受けた者は、当該業務を譲り渡した者の当該許可に基づく地位を承継することができる(関税法48条の2第4項)。したがって、「当該業務を譲り渡した者は、当該外国貨物を当該保税蔵置場から出し終わるまでは、当該保税蔵置場についての義務を免れることができない。」という部分は誤りであり、当該業務を譲り渡した者は、譲り渡した時点で当該保税蔵置場についての義務を免れる。
関税法（保税地域）,52-21-4,保税蔵置場の許可を受けている者であらかじめ税関長の承認を受けた者(承認取得者)が、位置又は設備が財務省令で定める基準に適合する場所において、その場所を所轄する税関長に届け出て、外国貨物の積卸し若しくは運搬をし、又はこれを置こうとする場合には、その届出に係る場所については、当該届出が受理された時において、保税蔵置場の許可を受けたものとみなされる。,○×,○,関税法第50条1項2項、42条1項にその通りの規定がある。特定保税承認制度のことであり、特定保税承認者は、税関長の許可ではなく税関長への届出で保税蔵置場が設置できる。
関税法（保税地域）,52-21-5,保税蔵置場の許可を受けている者であらかじめ税関長の承認を受けた者(承認取得者)は、当該承認について、10年ごとに更新を受けなければ、その期間の経過によって、その効力を失う。,○×,×,「10年ごと」ではなく「8年ごと」である(関税法50条4項)。
