カテゴリー,問題番号,問題,選択肢,正解,解説
関税法（運送）,52-9-3,保税運送の承認に際し税関長が指定した運送の期間について、その指定された期間の延長の申請を行おうとする者は、当該承認をした税関長又は当該承認に係る貨物のある場所を所轄する税関長に当該申請に係る申請書を提出しなければならない。,○×,○,税関長は、保税運送の承認をする場合においては、相当と認められる運送の期間を指定しなければならない。この場合において、その指定後災害その他やむを得ない事由が生じたため必要があると認めるときは、税関長は、その指定した期間を延長することができる(関税法63条4項)。そして、この規定により延長を受けようとする者は、保税運送の承認の申告の際に書面で提出する事項（運送に使用しようとする船舶、航空機又は車両の名称、登録記号又は種類、運送しようとする貨物の運送先、記号、番号、品名、数量及び価格並びに運送の期間及び目的）のほか、運送を承認した税関長、その承認の年月日、発送の年月日、当該運送について延長を必要とする期間及び事由を記載した申請書を、当該承認をした税関長又は当該貨物のある場所を所轄する税関長に提出しなければならない(同法施行令55条)。
関税法（運送）,52-9-4,税関長が指定する期間内に発送される外国貨物の運送について一括して保税運送の承認を受けた者であっても、当該承認に係る外国貨物の運送に際しては、その都度、運送目録を税関に提示し、その確認を受けなければならない。,○×,×,一括して保税運送の承認を受けた場合においては、指定された期間内に発送された外国貨物に係る運送目録ごとに、一括して確認を受けることができる(関税法63条3項ただし書)。
関税法（運送）,52-9-5,保税運送の承認を受けて運送された外国貨物(輸出の許可を受けた貨物を除く。)がその運送中に運送する者の重大な過失により亡失した場合であって、その承認の際に税関長が指定した期間内に運送先に到着しないときは、当該承認を受けた者から、直ちにその関税が徴収される。,○×,○,保税運送の承認を受けて運送された外国貨物（輸出の許可を受けた貨物を除く。）がその指定された運送の期間内に運送先に到着しないときは、運送の承認を受けた者から、直ちにその関税を徴収するのが原則である。ただし、当該貨物が災害その他やむを得ない事情により亡失した場合は、例外的に直ちに関税は徴収されない(関税法65条1項)。本問では、その運送中に運送する者の重大な過失により亡失した場合であるから、やむを得ない事情による亡失とはいえないため、原則どおり、運送の承認を受けた者から、直ちにその関税を徴収する。
関税定率法（軽減・免除・払戻し）,52-10-1,関税を納付して輸入された貨物のうち、品質が契約の内容と相違するため返送することがやむを得ないと認められるもので、その輸入の時の性質及び形状に変更を加えないものを、その輸入の許可の日から6月以内に保税地域に入れ、返送のため輸出する場合には、その関税の払戻しを受けることができる。,○×,○,関税を納付して輸入された貨物のうち、品質又は数量等が契約の内容と相違するため返送することがやむを得ないと認められるもので、その輸入の時の性質及び形状に変更を加えないものを、その輸入の許可の日から6月以内に保税地域に入れ、返送のため輸出する場合には、その関税の払戻しを受けることができる(違約品等の再輸出又は廃棄の場合の戻し税等 関税定率法20条1項1号)。
関税定率法（軽減・免除・払戻し）,52-10-2,関税を納付して輸入された貨物のうち、輸入後において法令によりその販売が禁止されるに至ったため輸出することがやむを得ないと認められるもので、その輸入の時の性質及び形状に変更を加えないものを、その輸入の許可の日から6月以内に保税地域に入れ、返送のため輸出する場合には、その関税の払戻しを受けることができる。,○×,○,関税を納付して輸入された貨物のうち、輸入後において法令（これに基づく処分を含む。）によりその販売、使用又はそれを用いた製品の販売、使用が禁止されるに至ったため輸出することがやむを得ないと認められるもので、その輸入の時の性質及び形状に変更を加えないものを、その輸入の許可の日から6月以内に保税地域に入れ、返送のため輸出する場合には、その関税の払戻しを受けることができる(違約品等の再輸出又は廃棄の場合の戻し税等 関税定率法20条1項3号)。
関税定率法（軽減・免除・払戻し）,52-10-3,関税を納付して輸入された貨物のうち、個人的な使用に供する物品で通信販売により販売されたものであって、品質が当該物品の輸入者が予期しなかったものであるため返送することがやむを得ないと認められるもので、その輸入の時の性質及び形状に変更を加えないものを、その輸入の許可の日から6月以内に保税地域に入れ、返送のため輸出する場合には、その関税の払戻しを受けることができる。,○×,○,関税を納付して輸入された貨物のうち、個人的な使用に供する物品で通信販売により販売されたものであって、品質が当該物品の輸入者が予期しなかったものであるため返送することがやむを得ないと認められるもので、その輸入の時の性質及び形状に変更を加えないものを、その輸入の許可の日から6月以内に保税地域に入れ、返送のため輸出する場合には、その関税の払戻しを受けることができる(関税定率法20条1項2号、同法施行令55条の2)。
関税定率法（軽減・免除・払戻し）,52-10-4,関税を納付して輸入された貨物のうち、品質が契約の内容と相違するため返送することがやむを得ないと認められるものを、その輸入の許可の日から6月以内に保税地域に入れ、やむを得ないと認められる事由により輸出に代えて廃棄する場合であっても、その関税が払戻しされることはない。,○×,×,このような場合、あらかじめ税関長の承認を受けて廃棄すれば、関税の全部か一部の払い戻しが受けられる(関税定率法20条1項、2項)。
関税定率法（軽減・免除・払戻し）,52-10-5,関税を納付して輸入された布地であって、品質が契約の内容と相違するため返送することがやむを得ないと認められるものを、その輸入の許可の日から6月以内に保税地域に入れ、返送のため輸出する場合において、当該布地が輸入後に切断されているときは、当該切断が布地の素材としての性質及び形状を失わない程度の切断であっても、その関税が払戻しされることはない。,○×,×,関税を納付して輸入された布地であって、品質が契約の内容と相違するため返送することがやむを得ないと認められるものを、その輸入の許可の日から6月以内に保税地域に入れ、返送のため輸出する場合は、その輸入の時の性質及び形状に変更を加えないといえるなら、関税の払戻しが受けられる(関税定率法20条1項)。そして、同法基本通達20-1(1)によると「その輸入の時の性質及び形状に変更を加えない」とは、輸入された貨物の性質及び形状に実質的な変化を加えないことをいうものとし、改装、 単なる分離、棒、板、布地等の素材としての性質形状を失わない程度の切断、その他これらに類する行為及び経済的な効用を発揮しない試験的使用による損傷は、これに含まれるとされる。すると、本問では、当該切断が布地の素材としての性質及び形状を失わない程度の切断なのだから、これを満たすため、払戻しが受けられる。  
関税定率法（課税価格の決定）,52-11-1,輸入貨物に係る特許権の使用に伴う対価のうち、当該輸入貨物を本邦において複製する権利に係るものについては、当該輸入貨物の課税価格に含まれる。,○×,×,輸入貨物に係る特許権の使用に伴う対価のうち、当該輸入貨物を本邦において複製する権利の使用に伴う対価は、加算費用から除外されているので課税価格に含まれない(関税定率法4条1項4号)。
関税定率法（課税価格の決定）,52-11-2,輸入貨物に係る輸入取引に関し買手により負担される手数料のうち、当該輸入貨物の買付けに関し当該買手を代理する者に対し、当該買付けに係る業務の対価として支払われるものは、当該輸入貨物の課税価格に含まれない。,○×,○,買付手数料なので、控除費用であり、課税価格に含まれない(関税定率法4条1項2号)。 
関税定率法（課税価格の決定）,52-11-3,輸入貨物が輸入港に到着するまでの運送について、保険が付されていない場合には、通常要すると認められる保険料の額として税関長が公示する額が当該輸入貨物の課税価格に含まれる。,○×,×,輸入貨物が輸入港に到着するまでの運送に要する保険料は、実際に要した保険料であるから、保険が付されていない場合には、通常要すると認められる保険料を見積もって課税価格に含めることはしない(関税定率法基本通達4-8(4))。  
関税定率法（課税価格の決定）,52-11-4,輸入貨物の輸入の許可の時の属する日以後に行われる当該輸入貨物に係る据付けに要する役務の費用の額が、当該輸入貨物につき買手により売手に対し又は売手のために行われた又は行われるべき支払の総額に含まれている場合において、当該費用の額を明らかにすることができないときは、関税定率法第4条第1項の規定により当該輸入貨物の課税価格を計算することはできない。,○×,×,輸入貨物の輸入申告の時の属する日以後に行われる当該輸入貨物に係る据付け、組立て、整備又は技術指導に要する役務の費用の額が、当該輸入貨物につき買手により売手に対し又は売手のために行われるべき支払の総額に含まれている場合において、当該費用の額を含んだものとしてでなければ当該支払の総額を把握することができないときは、当該明らかにすることができない費用の額を含めて課税価格を計算する(関税定率法法施行令1条の4第1号)。
関税定率法（課税価格の決定）,52-11-5,輸入貨物に係る輸入取引に関し買手により負担される当該輸入貨物の容器の費用のうち、当該輸入貨物の通常の容器と同一の種類及び価値を有するものの費用は、当該輸入貨物の課税価格に含まれる。,○×,○,輸入貨物に係る輸入取引に関し買手により負担される当該輸入貨物の容器の費用は加算費用となり課税価格に含まれるが、この容器とは、当該輸入貨物の通常の容器と同一の種類及び価値を有するものに限られる(関税定率法4条1項2号ロ)。つまり、その輸⼊貨物を⼊れるのに普通使われる容器と同じ種類・価値の容器に限られているので、例えば普通は使われないような⾼価なブランドものの容器や⾼額の装飾がされているような容器はこの容器に当たらない。
外国為替及び外国貿易法,52-12-1,国際郵便により送付され、かつ、受取人の個人的使用に供される職業用具を輸出しようとする場合には、当該貨物が輸出貿易管理令別表第2の1の項の中欄に掲げるダイヤモンドに該当するときであっても、経済産業大臣の輸出の承認を受けることを要しない。,○×,×,国際郵便により送付され、かつ、受取人の個人的使用に供される職業用具は、原則として経済産業大臣の輸出の承認は不要であるが、ダイヤモンドは、例外的にその承認を要する(輸出貿易管理令4条2項4号) 。
外国為替及び外国貿易法,52-12-2,仮に陸揚げした貨物のうち、本邦以外の地域を仕向地とする船荷証券により運送されたものを輸出する場合において、当該貨物が輸出貿易管理令別表第1の1の項の中欄に掲げる貨物に該当するときは、経済産業大臣の輸出の許可を受けなければならない。,○×,○,仮に陸揚げした貨物のうち、本邦以外の地域を仕向地とする船荷証券により運送されたものを輸出する場合は、原則として経済産業大臣の輸出の許可は不要だが、輸出貿易管理令別表第1の1の項の中欄に掲げる貨物（兵器）は、例外的に経済産業大臣の輸出の許可を要する(輸出貿易管理令4条1項1号)。
外国為替及び外国貿易法,52-12-3,輸出貿易管理令別表第1の2の項の中欄及び同令別表第2の20の項の中欄に掲げる核燃料物質に該当する貨物であって、経済産業大臣の輸出の許可及び承認を要する貨物に該当するものを輸出しようとする場合であっても、経済産業大臣の輸出の許可を受けたときは、経済産業大臣の輸出の承認を受けることを要しない。,○×,×,核燃料物質は、外為法48条1項、輸出貿易管理令1条により経済産業大臣の輸出の許可が要る物品として同令別表第1の2の項(1)の中欄に挙げられている。一方で、同法2条1項1号により経済産業大臣の輸出の承認が要る物品として同令別表第2の20の項の中欄にも挙げられている。このとき、これらの許可と承認は別の根拠条文に基づいて要求されるものであるから、許可を受ければ承認も受けたことになるというものではない。よくありがちな質問だが、許可や承認と一口に言っても、根拠条文が異なるときは例え同じ法律内で規定されていたとしてもそれぞれ別の目的で必要とされているので、例えばある根拠条文に基づく許可を受けたからといって別の根拠条文に基づく許可や承認を受けたことになるものではない。
外国為替及び外国貿易法,52-12-4,財務大臣が貨物の輸出を行う場合には、当該貨物が輸出貿易管理令別表第1の1の項の中欄に掲げる貨物に該当するときであっても、経済産業大臣の輸出の許可を受けることを要しない。,○×,×,経済産業大臣が貨物の輸出を行う場合は、輸出貿易管理令の規定は適用しないが(輸出貿易管理令13条1項)、財務大臣にはこの13条1項の対象外なのだから、同令の適用があり、同令別表第1の1の項の中欄に掲げる貨物（兵器）を輸出する場合は、経済産業大臣の輸出の許可を要する(同令1条)。
外国為替及び外国貿易法,52-12-5,外国為替及び外国貿易法48条に規定する経済産業大臣の輸出の承認の有効期間を延長する権限であって、経済産業大臣の指示する範囲内のものは、税関長に委任されるものとされている。,○×,○,経済産業大臣は、特に必要があると認めるときは、外為法48条1項の規定による許可について、同項の期間と異なる有効期間を定め、又はその有効期間を延長する権限を有するが(輸出貿易管理令8条2項)、この権限で、経済産業大臣の指示する範囲内のものは、税関長に委任される(同令12条2号ニ)。つまり、税関長が行使できるということである。
関税法（罰則）,52-13-1,関税法第110条第1項(関税を免れる等の罪)の犯罪に係る貨物について、その情を知って当該貨物を有償又は無償で取得した者は、関税法に基づき罰せられることがある。,○×,○,関税法110条1項（関税を免れる等の罪）の犯罪に係る貨物について、その情を知って当該貨物を有償又は無償で取得した者は、関税法112条1項で5年以下の拘禁刑若しくは500万円以下の罰金に処せられ、又はこれを併科されることがある。
関税法（罰則）,52-13-2,通関業者の偽りその他不正の行為により関税を免れた場合における当該行為をした通関業者については関税法に基づき罰せられることがあるが、当該行為により関税を免れようと実行に着手してこれを遂げない場合における当該行為をした通関業者については関税法に基づき罰せられることはない。,○×,×,通関業者の偽りその他不正の行為により関税を免れた場合における当該行為をした通関業者については関税法110条2項に基づき罰せられるし、当該行為により関税を免れようと実行に着手してこれを遂げない場合における当該行為をした通関業者についても同条3項に基づき罰せられる。ちなみに、「実行に着手してこれを遂げない」というのはいわゆる未遂犯というものである。犯罪を途中まで行ったけど最後までは出来なかったときに処罰する規定であり、刑罰にこのような未遂犯の規定が無い限りは、未遂の犯罪を処罰することはできない。また、この問題について、予備罪として罰せられるとする解説を見たことがあるが適切ではない。予備罪とは、犯罪の準備行為自体を罰する罪であり、確かに同条4項に予備罪が規定されている。しかし本問は、通関業者の偽りその他不正の行為により関税を免れようと実行に着手してこれを遂げない場合とされており、通関業者の偽りその他不正の行為により関税を免れる犯罪(同条2項)を途中まで行ったけど最後まではできなかった場合なので、そもそも同条2項の犯罪を行わず準備をしているだけの予備罪(4項)に当たらないからである。 
関税法（罰則）,52-13-3,関税法第109条(輸入してはならない貨物を輸入する罪)の犯罪に係る貨物については没収されることがあるが、その犯罪行為の用に供した船舶又は航空機については没収されることはない。,○×,×,関税法110条の罪を犯した場合には、原則として、当該犯罪に係る貨物の他、その犯罪行為の用に供した船舶又は航空機についても没収される(同法118条1項)。
関税法（罰則）,52-13-4,法人の従業者がその法人の業務について、関税法第111条第1項(許可を受けないで輸出入する等の罪)に該当する違反行為をした場合には、当該従業者が関税法に基づき罰せられることがあるほか、その法人に対しても罰金刑が科されることがある。,○×,○,関税法117条1項により「法人の代表者又は法人若しくは人の代理人、使用人その他の従業者がその法人又は人の業務又は財産について、108条の4から112条まで…に該当する違反行為…をしたときは、その行為者を罰するほか、その法人又は人に対して当該各条の罰金刑を科する。」とされており（両罰規定）、法人の従業者がその法人の業務について、関税法第111条第1項(許可を受けないで輸出入する等の罪)に該当する違反行為をした場合には、当該従業者が同法の規定に基づき罰せられることがあるほか、その法人に対しても罰金刑が科せられることがある。
関税法（罰則）,52-13-5,重大な過失により関税法第32条の規定に違反して税関長の許可を受けないで保税地域にある外国貨物を見本として一時持ち出した者は、関税法に基づき罰せられることはない。,○×,×,これは関税法115条の2第6号に規定する行為に該当することになるので、同法116条により過失犯として罰せられる。
関税法（輸入してはならない貨物）,52-14-1,税関長は、輸入されようとする貨物のうちに意匠権を侵害する物品に該当する貨物があると思料するときは、認定手続を執ることなく、当該貨物を没収して廃棄することができる。,○×,×,税関長は、意匠権等の知的財産権を侵害する貨物に該当する貨物があると思料するときは、没収して廃棄し、又は積戻しを命ずることができる(関税法69条の11第2項)が、認定手続を経た後でなければ、当該措置をとることはできない(同法69条の12第4項)。
関税法（輸入してはならない貨物）,52-14-2,税関長は、育成者権を侵害する貨物に該当するか否かについての認定手続において、その認定をするために必要があると認めるときは、経済産業大臣に対し、当該認定のための参考となるべき意見を求めることができる。,○×,×,育成者権を侵害する貨物に該当するか否かの認定手続なので、「経済産業大臣」ではなく「農林水産大臣」である(関税法69条の18第1項)。
関税法（輸入してはならない貨物）,52-14-3,輸入差止申立てが受理された商標権者は、当該申立てに係る貨物について認定手続が執られている間に限り、税関長に対し、当該認定手続に係る疑義貨物について、当該商標権者がその見本の検査をすることを承認するよう申請することができる。,○×,○,輸入差止申立てが受理された特許権者、実用新案権者、意匠権者、商標権者、著作権者、著作隣接権者若しくは育成者権者又は不正競争差止請求権者は、当該申立てに係る貨物について認定手続が執られている間に限り、税関長に対し、当該認定手続に係る疑義貨物について、当該商標権者がその見本の検査をすることを承認するよう申請することができる。この場合において、当該申請を受けた税関長は、その旨を当該疑義貨物を輸入しようとする者に通知しなければならない(関税法69条の16第1項)。
関税法（輸入してはならない貨物）,52-14-4,麻薬及び大麻は、政府が輸入するもの及び他の法令の規定により輸入することができることとされている者が当該他の法令の定めるところにより輸入するものを除き、輸入してはならない貨物に該当する。,○×,○,麻薬、向精神薬、大麻、あへん、けしがら、覚醒剤（覚醒剤取締法にいう覚醒剤原料を含む。）、あへん吸煙具は、政府が輸入するもの及び他の法令の規定により輸入することができることとされている者が当該他の法令の定めるところにより輸入するものを除いて、輸入してはならない貨物である(関税法69条の11第1項1号)。
関税法（輸入してはならない貨物）,52-14-5,税関長は、風俗を害すべき書籍で輸入されようとするものを没収して廃棄し、又は当該書籍を輸入しようとする者にその積戻しを命じなければならない。,○×,×,公安又は風俗を害すべき書籍、図画、彫刻物その他の物品、児童ポルノについては、没収・廃棄や、積戻しを命ずることはできず、当該貨物を輸入しようとする者に対し、これらに該当すると認めるのに相当の理由がある旨を通知しなければならない(関税法69条の11第3項、1項7号8号)。この通知を受けた者は、自発的に廃棄や滅却、積戻し（児童ポルノを除く）、該当箇所の修正や削除等を行い、通知に不服があれば不服申立てを行う(基本通達69の11-3)。
